{"authority_snapshot_sha256":"28be6f6fdafb970ddc7bf4aa35428ac54ea2f6bec808e278d8e03f882e24f71b","blockers":[],"domain_registry_sha256":"6dd5cc2fd9e97cefdd9808b803790fe40ca0d8601a22647e526e56e421baa819","execution_plan_sha256":"3a8147325aa4b33b53a4c025605cda0cdfd719a111bb8078bdbbad7464d453f3","schema_version":1,"scope":"plugin:termux-large-doc-editor","sources":[{"authority_class":"declared_by","content":"| --- | --- | --- | --- | --- | --- |\n| plugin:devpass | DevPass | declared-update-channel | plugins/devpass/** | declaredBy=plugins/devpass/README.md; artifact=plugins/devpass/latest.js; ref=main | docs/DEVPASS_GUIDELINES.md |\n| plugin:simcore | SimCore | production | plugins/simcore/** | releaseBranch=release-simcore; manifest=product-manifest.json; artifact=plugins/simcore/latest.js | docs/SIMCORE_GUIDELINES.md |\n| plugin:termux-large-doc-editor | Termux Large Doc Editor | prototype | plugins/termux/large-doc-editor/** | evidence=plugins/termux/large-doc-editor/README.md | docs/TERMUX_DEVELOPMENT_GUIDELINES.md |\n| plugin:usage-dashboard | Local Usage Dashboard | production | plugins/usage-dashboard/** | releaseBranch=release-usage-dashboard; manifest=plugins/usage-dashboard/runtime/product-manifest.json; artifact=plugins/usage-dashboard/latest.js; releaseSpecDir=.github/usage-dashboard/releases | docs/USAGE_DASHBOARD_GUIDELINES.md |\n| plugin:voyage-token-check | Voyage Token Check | design-evidence-validation | voyage-token-check/** | evidence=voyage-token-check/DESIGN_STATUS.md | docs/VOYAGE_TOKEN_CHECK_GUIDELINES.md |\n| product:pocketrisu-helper-mod | PocketRisu Helper Mod | operations-product-root | products/pocketrisu-helper-mod/** | manifest=products/pocketrisu-helper-mod/product.json; currentState=products/pocketrisu-helper-mod/CURRENT.md | docs/POCKETRISU_HELPER_MOD_GUIDELINES.md |","end_line":12,"path":"docs/REPO_PROJECT_CATALOG.md","source_id":"S1","source_ref":{"block_digest":"b9f03623549cfac8693a6a7fcb10d587e7523bacb7fd6b02bfe192266d85c55c","ref":"S1@L6","source_sha":"f01c2ef304656de9254191ec2fb9a2c046642f21"},"source_sha":"f01c2ef304656de9254191ec2fb9a2c046642f21","start_line":6},{"authority_class":"guidelines","content":"\nCanonical plugin path: `plugins/termux/`\n\nProduction release branch: `UNKNOWN — not established yet`\n\nNever infer the current production version from conversation memory.\nRead the actual repository and production release branch first.","end_line":12,"path":"docs/TERMUX_DEVELOPMENT_GUIDELINES.md","source_id":"S2","source_ref":{"block_digest":"1f3100835d29ddf83264185525b152f66b945ffcd326a54a27132a5770fd46d1","ref":"S2@L6","source_sha":"f01c2ef304656de9254191ec2fb9a2c046642f21"},"source_sha":"f01c2ef304656de9254191ec2fb9a2c046642f21","start_line":6},{"authority_class":"guidelines","content":"- expensive full scans\n- unbounded history\n- large raw payload persistence\n- unnecessary network calls\n- high-frequency polling\n\n## 11. Protected stability","end_line":259,"path":"docs/TERMUX_DEVELOPMENT_GUIDELINES.md","source_id":"S3","source_ref":{"block_digest":"c7652dc04ebd45082ee124112c47099373a29340786268967960b8f5baf76283","ref":"S3@L253","source_sha":"f01c2ef304656de9254191ec2fb9a2c046642f21"},"source_sha":"f01c2ef304656de9254191ec2fb9a2c046642f21","start_line":253},{"authority_class":"guidelines","content":"- updater\n- automatic update flow\n- runtime lifecycle\n- state persistence\n- request identity\n- source fidelity\n- navigation","end_line":271,"path":"docs/TERMUX_DEVELOPMENT_GUIDELINES.md","source_id":"S4","source_ref":{"block_digest":"e21cea5a54b90d5075ceb46b1d6e1e09f8bbfdc8bd2b6ebe41479eda17f44495","ref":"S4@L265","source_sha":"f01c2ef304656de9254191ec2fb9a2c046642f21"},"source_sha":"f01c2ef304656de9254191ec2fb9a2c046642f21","start_line":265},{"authority_class":"evidence","content":"\nPurpose: test whether a chunked mobile editing surface remains responsive on large documents without rendering the entire document in the browser.\n\nThis is **not** a Google Docs replacement, production release, or APK patch. It is an evidence-gathering prototype for Issue #202.\n\n## Current scope\n\n- localhost-only Python server\n- no third-party Python packages\n- UTF-8 `.txt`, `.md`, `.log`, `.json`\n- current-chunk-only browser editing\n- explicit atomic file save\n- fail-closed save if the source changed outside the editor\n- basic input-to-paint latency display\n- no Google account, Drive, Docs API, DOCX, rich formatting, comments, suggestions, or collaboration yet","end_line":16,"path":"plugins/termux/large-doc-editor/README.md","source_id":"S5","source_ref":{"block_digest":"94643af92827a269c673f13e62cbec5e89272dbeba28039aa618bc87fd70898a","ref":"S5@L2","source_sha":"f01c2ef304656de9254191ec2fb9a2c046642f21"},"source_sha":"f01c2ef304656de9254191ec2fb9a2c046642f21","start_line":2},{"authority_class":"domain_primary","content":"            raise FileNotFoundError(self.relative_path)\n\n        self.original_mtime_ns = self.path.stat().st_mtime_ns\n        self.chunks = split_text(self.path.read_text(encoding=\"utf-8\"), self.target_chars)\n        self.dirty = False\n\n    @property\n    def character_count(self) -> int:\n        return sum(len(chunk) for chunk in self.chunks)\n\n    def get_chunk(self, index: int) -> str:\n        return self.chunks[index]\n\n    def update_chunk(self, index: int, text: str) -> None:\n        if index < 0 or index >= len(self.chunks):\n            raise IndexError(index)\n        self.chunks[index] = text\n        self.dirty = True\n\n    def save(self) -> None:\n        \"\"\"Write atomically and fail closed if another process changed the source.\"\"\"\n        if not self.path.exists():\n            raise SourceChangedError(\"source file disappeared\")\n\n        current_mtime_ns = self.path.stat().st_mtime_ns\n        if current_mtime_ns != self.original_mtime_ns:\n            raise SourceChangedError(\"source file changed outside this editor\")\n\n        tmp_path = self.path.with_name(f\".{self.path.name}.termux-editor.tmp\")\n        tmp_path.write_text(\"\".join(self.chunks), encoding=\"utf-8\")\n        os.replace(tmp_path, self.path)\n\n        self.original_mtime_ns = self.path.stat().st_mtime_ns\n        self.dirty = False","end_line":106,"path":"plugins/termux/large-doc-editor/chunk_store.py","source_id":"S6","source_ref":{"block_digest":"7d86a7ee44cc09936141f5f9de6a1c9e11e5c3731395e84fa202fc7f099eaa08","ref":"S6@L73","source_sha":"f01c2ef304656de9254191ec2fb9a2c046642f21"},"source_sha":"f01c2ef304656de9254191ec2fb9a2c046642f21","start_line":73},{"authority_class":"domain_primary","content":"                index = int(payload.get(\"index\", -1))\n                text = payload.get(\"text\")\n                if not isinstance(text, str):\n                    raise ValueError(\"text must be a string\")\n                session.update_chunk(index, text)\n                self.send_json({\"ok\": True, \"dirty\": session.dirty})\n                return\n\n            if parsed.path == \"/api/save\":\n                session = self.state.get(str(payload.get(\"session\", \"\")))\n                session.save()\n                self.send_json({\"ok\": True, \"dirty\": session.dirty})\n                return\n\n            self.send_error(HTTPStatus.NOT_FOUND)\n        except FileNotFoundError as exc:\n            self.send_json({\"error\": f\"file not found: {exc}\"}, HTTPStatus.NOT_FOUND)\n        except SourceChangedError as exc:\n            self.send_json({\"error\": str(exc), \"code\": \"SOURCE_CHANGED\"}, HTTPStatus.CONFLICT)\n        except (ValueError, IndexError, KeyError, json.JSONDecodeError) as exc:\n            self.send_json({\"error\": str(exc)}, HTTPStatus.BAD_REQUEST)","end_line":164,"path":"plugins/termux/large-doc-editor/server.py","source_id":"S7","source_ref":{"block_digest":"61a285d9e7e2707722741fd20f0a31c57a531538b8f0161083e84c2342b3ed95","ref":"S7@L144","source_sha":"f01c2ef304656de9254191ec2fb9a2c046642f21"},"source_sha":"f01c2ef304656de9254191ec2fb9a2c046642f21","start_line":144},{"authority_class":"domain_primary","content":"            root = Path(temp)\n            with self.assertRaises(ValueError):\n                resolve_workspace_path(root, \"../outside.txt\")\n\n    def test_edit_and_atomic_save(self):\n        with tempfile.TemporaryDirectory() as temp:\n            path = Path(temp) / \"doc.txt\"\n            path.write_text(\"hello\\n\" * 4000, encoding=\"utf-8\")\n            session = DocumentSession(Path(temp), \"doc.txt\", 2048)\n            session.update_chunk(0, \"PREFIX\\n\" + session.get_chunk(0))\n            session.save()\n            self.assertTrue(path.read_text(encoding=\"utf-8\").startswith(\"PREFIX\\n\"))\n            self.assertFalse(session.dirty)\n\n    def test_external_change_fails_closed(self):\n        with tempfile.TemporaryDirectory() as temp:\n            path = Path(temp) / \"doc.txt\"\n            path.write_text(\"original\", encoding=\"utf-8\")\n            session = DocumentSession(Path(temp), \"doc.txt\", 2048)","end_line":38,"path":"plugins/termux/large-doc-editor/tests/test_chunk_store.py","source_id":"S8","source_ref":{"block_digest":"d639642712d2ca6c22b57dfcc57c7286cb2352800a5f2dc2c97e9969142664d5","ref":"S8@L20","source_sha":"f01c2ef304656de9254191ec2fb9a2c046642f21"},"source_sha":"f01c2ef304656de9254191ec2fb9a2c046642f21","start_line":20},{"authority_class":"domain_primary","content":"    select.append(option);\n  }\n}\n\nasync function flushChunk() {\n  if (!state.session || !state.dirtyChunk) return;\n  const text = $(\"editor\").value;\n  await request(\"/api/chunk\", {\n    method: \"POST\",\n    body: JSON.stringify({\n      session: state.session,\n      index: state.chunkIndex,\n      text,\n    }),\n  });\n  state.dirtyChunk = false;\n  setStatus(\"메모리에 반영됨 · 파일 저장 필요\");\n}\n\nfunction queueChunkFlush() {\n  clearTimeout(state.flushTimer);\n  state.flushTimer = setTimeout(() => {\n    flushChunk().catch((error) => setStatus(error.message, true)